"Any comprehensive register of criminal convictions shall be kept only under the control of official authority.";"kept";"after Initial: [personal data, processing, restriction, profiling, pseudonymisation, filing system, controller, processor, recipient, third party, ‘consent, personal data breach, genetic data, biometric data, data, main establishment, enterprise, group, supervisory authority, supervisory authority, ‘relevant and reasoned objection, information society service, international organisation]";"after ImperativeFilter: [personal data, processing, restriction, profiling, pseudonymisation, filing system, controller, processor, recipient, third party, ‘consent, personal data breach, genetic data, biometric data, data, main establishment, enterprise, group, supervisory authority, supervisory authority, ‘relevant and reasoned objection, information society service, international organisation]";"after DependentOfSameSentenceFilter: [personal data, processing, restriction, profiling, pseudonymisation, filing system, controller, processor, recipient, third party, ‘consent, personal data breach, genetic data, biometric data, data, main establishment, enterprise, group, supervisory authority, supervisory authority, ‘relevant and reasoned objection, information society service, international organisation]";"after PartOfSpeechFilter: [personal data, processing, restriction, profiling, pseudonymisation, filing system, controller, processor, recipient, third party, ‘consent, personal data breach, genetic data, biometric data, data, main establishment, enterprise, group, supervisory authority, supervisory authority, ‘relevant and reasoned objection, information society service, international organisation]";"after VerbLinkFilter: [personal data, processing, restriction, profiling, pseudonymisation, filing system, controller, processor, recipient, third party, ‘consent, personal data breach, genetic data, biometric data, data, main establishment, enterprise, group, supervisory authority, supervisory authority, ‘relevant and reasoned objection, information society service, international organisation]";"after SynsetFilter: [filing system, controller, processor, recipient, third party, enterprise, supervisory authority, supervisory authority, information society service]";"after PerplexityFilter: [supervisory authority, supervisory authority, third party]"
"If the purposes for which a controller processes personal data do not or do no longer require the identification of a data subject by the controller, the controller shall not be obliged to maintain, acquire or process additional information in order to identify the data subject for the sole purpose of complying with this Regulation."
"Where, in cases referred to in paragraph 1 of this Article, the controller is able to demonstrate that it is not in a position to identify the data subject, the controller shall inform the data subject accordingly, if possible."
"In such cases, Articles 15 to 20 shall not apply except where the data subject, for the purpose of exercising his or her rights under those articles, provides additional information enabling his or her identification."
"The controller shall take appropriate measures to provide any information referred to in Articles 13 and 14 and any communication under Articles 15 to 22 and 34 relating to processing to the data subject in a concise, transparent, intelligible and easily accessible form, using clear and plain language, in particular for any information addressed specifically to a child.";"addressed";"after Initial: [personal data, processing, restriction, profiling, pseudonymisation, filing system, controller, processor, recipient, third party, ‘consent, personal data breach, genetic data, biometric data, data, main establishment, enterprise, group, supervisory authority, supervisory authority, ‘relevant and reasoned objection, information society service, international organisation]";"after ImperativeFilter: [personal data, processing, restriction, profiling, pseudonymisation, filing system, controller, processor, recipient, third party, ‘consent, personal data breach, genetic data, biometric data, data, main establishment, enterprise, group, supervisory authority, supervisory authority, ‘relevant and reasoned objection, information society service, international organisation]";"after DependentOfSameSentenceFilter: [personal data, processing, restriction, profiling, pseudonymisation, filing system, controller, processor, recipient, third party, ‘consent, personal data breach, genetic data, biometric data, data, main establishment, enterprise, group, supervisory authority, supervisory authority, ‘relevant and reasoned objection, information society service, international organisation]";"after PartOfSpeechFilter: [personal data, processing, restriction, profiling, pseudonymisation, filing system, controller, processor, recipient, third party, ‘consent, personal data breach, genetic data, biometric data, data, main establishment, enterprise, group, supervisory authority, supervisory authority, ‘relevant and reasoned objection, information society service, international organisation]";"after VerbLinkFilter: [international organisation]";"after SynsetFilter: [international organisation]";"after PerplexityFilter: [international organisation]"
"The information shall be provided in writing, or by other means, including, where appropriate, by electronic means.";"writing";"after Initial: [personal data, processing, restriction, profiling, pseudonymisation, filing system, controller, processor, recipient, third party, ‘consent, personal data breach, genetic data, biometric data, data, main establishment, enterprise, group, supervisory authority, supervisory authority, ‘relevant and reasoned objection, information society service, international organisation]";"after ImperativeFilter: [personal data, processing, restriction, profiling, pseudonymisation, filing system, controller, processor, recipient, third party, ‘consent, personal data breach, genetic data, biometric data, data, main establishment, enterprise, group, supervisory authority, supervisory authority, ‘relevant and reasoned objection, information society service, international organisation]";"after DependentOfSameSentenceFilter: [personal data, processing, restriction, profiling, pseudonymisation, filing system, controller, processor, recipient, third party, ‘consent, personal data breach, genetic data, biometric data, data, main establishment, enterprise, group, supervisory authority, supervisory authority, ‘relevant and reasoned objection, information society service, international organisation]";"after PartOfSpeechFilter: [personal data, processing, restriction, profiling, pseudonymisation, filing system, controller, processor, recipient, third party, ‘consent, personal data breach, genetic data, biometric data, data, main establishment, enterprise, group, supervisory authority, supervisory authority, ‘relevant and reasoned objection, information society service, international organisation]";"after VerbLinkFilter: [personal data, processing, restriction, profiling, pseudonymisation, filing system, controller, processor, recipient, third party, ‘consent, personal data breach, genetic data, biometric data, data, main establishment, enterprise, group, supervisory authority, supervisory authority, ‘relevant and reasoned objection, information society service, international organisation]";"after SynsetFilter: [filing system, controller, processor, recipient, third party, enterprise, supervisory authority, supervisory authority, information society service]";"after PerplexityFilter: [filing system, controller, processor, recipient, third party, enterprise, supervisory authority, supervisory authority, information society service]";"provided";"after Initial: [personal data, processing, restriction, profiling, pseudonymisation, filing system, controller, processor, recipient, third party, ‘consent, personal data breach, genetic data, biometric data, data, main establishment, enterprise, group, supervisory authority, supervisory authority, ‘relevant and reasoned objection, information society service, international organisation]";"after ImperativeFilter: [personal data, processing, restriction, profiling, pseudonymisation, filing system, controller, processor, recipient, third party, ‘consent, personal data breach, genetic data, biometric data, data, main establishment, enterprise, group, supervisory authority, supervisory authority, ‘relevant and reasoned objection, information society service, international organisation]";"after DependentOfSameSentenceFilter: [personal data, processing, restriction, profiling, pseudonymisation, filing system, controller, processor, recipient, third party, ‘consent, personal data breach, genetic data, biometric data, data, main establishment, enterprise, group, supervisory authority, supervisory authority, ‘relevant and reasoned objection, information society service, international organisation]";"after PartOfSpeechFilter: [personal data, processing, restriction, profiling, pseudonymisation, filing system, controller, processor, recipient, third party, ‘consent, personal data breach, genetic data, biometric data, data, main establishment, enterprise, group, supervisory authority, supervisory authority, ‘relevant and reasoned objection, information society service, international organisation]";"after VerbLinkFilter: [controller, international organisation]";"after SynsetFilter: [controller]";"after PerplexityFilter: [controller]"
"When requested by the data subject, the information may be provided orally, provided that the identity of the data subject is proven by other means.";"provided";"after Initial: [personal data, processing, restriction, profiling, pseudonymisation, filing system, controller, processor, recipient, third party, ‘consent, personal data breach, genetic data, biometric data, data, main establishment, enterprise, group, supervisory authority, supervisory authority, ‘relevant and reasoned objection, information society service, international organisation]";"after ImperativeFilter: [personal data, processing, restriction, profiling, pseudonymisation, filing system, controller, processor, recipient, third party, ‘consent, personal data breach, genetic data, biometric data, data, main establishment, enterprise, group, supervisory authority, supervisory authority, ‘relevant and reasoned objection, information society service, international organisation]";"after DependentOfSameSentenceFilter: [personal data, processing, restriction, profiling, pseudonymisation, filing system, controller, processor, recipient, third party, ‘consent, personal data breach, genetic data, biometric data, data, main establishment, enterprise, group, supervisory authority, supervisory authority, ‘relevant and reasoned objection, information society service, international organisation]";"after PartOfSpeechFilter: [personal data, processing, restriction, profiling, pseudonymisation, filing system, controller, processor, recipient, third party, ‘consent, personal data breach, genetic data, biometric data, data, main establishment, enterprise, group, supervisory authority, supervisory authority, ‘relevant and reasoned objection, information society service, international organisation]";"after VerbLinkFilter: [controller, international organisation]";"after SynsetFilter: [controller]";"after PerplexityFilter: [controller]";"provided";"after Initial: [personal data, processing, restriction, profiling, pseudonymisation, filing system, controller, processor, recipient, third party, ‘consent, personal data breach, genetic data, biometric data, data, main establishment, enterprise, group, supervisory authority, supervisory authority, ‘relevant and reasoned objection, information society service, international organisation]";"after ImperativeFilter: [personal data, processing, restriction, profiling, pseudonymisation, filing system, controller, processor, recipient, third party, ‘consent, personal data breach, genetic data, biometric data, data, main establishment, enterprise, group, supervisory authority, supervisory authority, ‘relevant and reasoned objection, information society service, international organisation]";"after DependentOfSameSentenceFilter: [personal data, processing, restriction, profiling, pseudonymisation, filing system, controller, processor, recipient, third party, ‘consent, personal data breach, genetic data, biometric data, data, main establishment, enterprise, group, supervisory authority, supervisory authority, ‘relevant and reasoned objection, information society service, international organisation]";"after PartOfSpeechFilter: [personal data, processing, restriction, profiling, pseudonymisation, filing system, controller, processor, recipient, third party, ‘consent, personal data breach, genetic data, biometric data, data, main establishment, enterprise, group, supervisory authority, supervisory authority, ‘relevant and reasoned objection, information society service, international organisation]";"after VerbLinkFilter: [controller, international organisation]";"after SynsetFilter: [controller]";"after PerplexityFilter: [controller]"
"The controller shall facilitate the exercise of data subject rights under Articles 15 to 22."
"In the cases referred to in Article 11(2), the controller shall not refuse to act on the request of the data subject for exercising his or her rights under Articles 15 to 22, unless the controller demonstrates that it is not in a position to identify the data subject."
"The controller shall provide information on action taken on a request under Articles 15 to 22 to the data subject without undue delay and in any event within one month of receipt of the request.";"taken";"after Initial: [personal data, processing, restriction, profiling, pseudonymisation, filing system, controller, processor, recipient, third party, ‘consent, personal data breach, genetic data, biometric data, data, main establishment, enterprise, group, supervisory authority, supervisory authority, ‘relevant and reasoned objection, information society service, international organisation]";"after ImperativeFilter: [personal data, processing, restriction, profiling, pseudonymisation, filing system, controller, processor, recipient, third party, ‘consent, personal data breach, genetic data, biometric data, data, main establishment, enterprise, group, supervisory authority, supervisory authority, ‘relevant and reasoned objection, information society service, international organisation]";"after DependentOfSameSentenceFilter: [personal data, processing, restriction, profiling, pseudonymisation, filing system, controller, processor, recipient, third party, ‘consent, personal data breach, genetic data, biometric data, data, main establishment, enterprise, group, supervisory authority, supervisory authority, ‘relevant and reasoned objection, information society service, international organisation]";"after PartOfSpeechFilter: [personal data, processing, restriction, profiling, pseudonymisation, filing system, controller, processor, recipient, third party, ‘consent, personal data breach, genetic data, biometric data, data, main establishment, enterprise, group, supervisory authority, supervisory authority, ‘relevant and reasoned objection, information society service, international organisation]";"after VerbLinkFilter: [personal data, processing, restriction, profiling, pseudonymisation, filing system, controller, processor, recipient, third party, ‘consent, personal data breach, genetic data, biometric data, data, main establishment, enterprise, group, supervisory authority, supervisory authority, ‘relevant and reasoned objection, information society service, international organisation]";"after SynsetFilter: [filing system, controller, processor, recipient, third party, enterprise, supervisory authority, supervisory authority, information society service]";"after PerplexityFilter: [controller, third party, supervisory authority]"
"That period may be extended by two further months where necessary, taking into account the complexity and number of the requests.";"taking";"after Initial: [personal data, processing, restriction, profiling, pseudonymisation, filing system, controller, processor, recipient, third party, ‘consent, personal data breach, genetic data, biometric data, data, main establishment, enterprise, group, supervisory authority, supervisory authority, ‘relevant and reasoned objection, information society service, international organisation]";"after ImperativeFilter: [personal data, processing, restriction, profiling, pseudonymisation, filing system, controller, processor, recipient, third party, ‘consent, personal data breach, genetic data, biometric data, data, main establishment, enterprise, group, supervisory authority, supervisory authority, ‘relevant and reasoned objection, information society service, international organisation]";"after DependentOfSameSentenceFilter: [personal data, processing, restriction, profiling, pseudonymisation, filing system, controller, processor, recipient, third party, ‘consent, personal data breach, genetic data, biometric data, data, main establishment, enterprise, group, supervisory authority, supervisory authority, ‘relevant and reasoned objection, information society service, international organisation]";"after PartOfSpeechFilter: [personal data, processing, restriction, profiling, pseudonymisation, filing system, controller, processor, recipient, third party, ‘consent, personal data breach, genetic data, biometric data, data, main establishment, enterprise, group, supervisory authority, supervisory authority, ‘relevant and reasoned objection, information society service, international organisation]";"after VerbLinkFilter: [personal data, processing, restriction, profiling, pseudonymisation, filing system, controller, processor, recipient, third party, ‘consent, personal data breach, genetic data, biometric data, data, main establishment, enterprise, group, supervisory authority, supervisory authority, ‘relevant and reasoned objection, information society service, international organisation]";"after SynsetFilter: [filing system, controller, processor, recipient, third party, enterprise, supervisory authority, supervisory authority, information society service]";"after PerplexityFilter: [supervisory authority, supervisory authority, third party]"
"The controller shall inform the data subject of any such extension within one month of receipt of the request, together with the reasons for the delay."
"Where the data subject makes the request by electronic form means, the information shall be provided by electronic means where possible, unless otherwise requested by the data subject."
"If the controller does not take action on the request of the data subject, the controller shall inform the data subject without delay and at the latest within one month of receipt of the request of the reasons for not taking action and on the possibility of lodging a complaint with a supervisory authority and seeking a judicial remedy.";"seeking";"after Initial: [personal data, processing, restriction, profiling, pseudonymisation, filing system, controller, processor, recipient, third party, ‘consent, personal data breach, genetic data, biometric data, data, main establishment, enterprise, group, supervisory authority, supervisory authority, ‘relevant and reasoned objection, information society service, international organisation]";"after ImperativeFilter: [personal data, processing, restriction, profiling, pseudonymisation, filing system, controller, processor, recipient, third party, ‘consent, personal data breach, genetic data, biometric data, data, main establishment, enterprise, group, supervisory authority, supervisory authority, ‘relevant and reasoned objection, information society service, international organisation]";"after DependentOfSameSentenceFilter: [personal data, processing, restriction, profiling, pseudonymisation, filing system, controller, processor, recipient, third party, ‘consent, personal data breach, genetic data, biometric data, data, main establishment, enterprise, group, supervisory authority, supervisory authority, ‘relevant and reasoned objection, information society service, international organisation]";"after PartOfSpeechFilter: [personal data, processing, restriction, profiling, pseudonymisation, filing system, controller, processor, recipient, third party, ‘consent, personal data breach, genetic data, biometric data, data, main establishment, enterprise, group, supervisory authority, supervisory authority, ‘relevant and reasoned objection, information society service, international organisation]";"after VerbLinkFilter: [personal data, processing, restriction, profiling, pseudonymisation, filing system, controller, processor, recipient, third party, ‘consent, personal data breach, genetic data, biometric data, data, main establishment, enterprise, group, supervisory authority, supervisory authority, ‘relevant and reasoned objection, information society service, international organisation]";"after SynsetFilter: [filing system, controller, processor, recipient, third party, enterprise, supervisory authority, supervisory authority, information society service]";"after PerplexityFilter: [supervisory authority, supervisory authority, controller]"
