"Personal data shall be processed lawfully, fairly and in a transparent manner in relation to the data subject (‘lawfulness, fairness and transparency’).";"processed";"after Initial: [personal data, processing, restriction, profiling, pseudonymisation, filing system, controller, processor, recipient, third party, ‘consent, personal data breach, genetic data, biometric data, data, main establishment, enterprise, group, supervisory authority, supervisory authority, ‘relevant and reasoned objection, information society service, international organisation]";"after ImperativeFilter: [personal data, processing, restriction, profiling, pseudonymisation, filing system, controller, processor, recipient, third party, ‘consent, personal data breach, genetic data, biometric data, data, main establishment, enterprise, group, supervisory authority, supervisory authority, ‘relevant and reasoned objection, information society service, international organisation]";"after DependentOfSameSentenceFilter: [processing, restriction, profiling, pseudonymisation, filing system, controller, processor, recipient, third party, ‘consent, personal data breach, data, main establishment, enterprise, group, supervisory authority, supervisory authority, ‘relevant and reasoned objection, information society service, international organisation]";"after PartOfSpeechFilter: [processing, restriction, profiling, pseudonymisation, filing system, controller, processor, recipient, third party, ‘consent, personal data breach, data, main establishment, enterprise, group, supervisory authority, supervisory authority, ‘relevant and reasoned objection, information society service, international organisation]";"after VerbLinkFilter: [processor]";"after SynsetFilter: [processor]";"after PerplexityFilter: [processor]"
"Personal data shall be collected for specified, explicit and legitimate purposes and not further processed in a manner that is incompatible with those purposes.";"collected";"after Initial: [personal data, processing, restriction, profiling, pseudonymisation, filing system, controller, processor, recipient, third party, ‘consent, personal data breach, genetic data, biometric data, data, main establishment, enterprise, group, supervisory authority, supervisory authority, ‘relevant and reasoned objection, information society service, international organisation]";"after ImperativeFilter: [personal data, processing, restriction, profiling, pseudonymisation, filing system, controller, processor, recipient, third party, ‘consent, personal data breach, genetic data, biometric data, data, main establishment, enterprise, group, supervisory authority, supervisory authority, ‘relevant and reasoned objection, information society service, international organisation]";"after DependentOfSameSentenceFilter: [processing, restriction, profiling, pseudonymisation, filing system, controller, processor, recipient, third party, ‘consent, personal data breach, data, main establishment, enterprise, group, supervisory authority, supervisory authority, ‘relevant and reasoned objection, information society service, international organisation]";"after PartOfSpeechFilter: [processing, restriction, profiling, pseudonymisation, filing system, controller, processor, recipient, third party, ‘consent, personal data breach, data, main establishment, enterprise, group, supervisory authority, supervisory authority, ‘relevant and reasoned objection, information society service, international organisation]";"after VerbLinkFilter: [processor]";"after SynsetFilter: [processor]";"after PerplexityFilter: [processor]";"processed";"after Initial: [personal data, processing, restriction, profiling, pseudonymisation, filing system, controller, processor, recipient, third party, ‘consent, personal data breach, genetic data, biometric data, data, main establishment, enterprise, group, supervisory authority, supervisory authority, ‘relevant and reasoned objection, information society service, international organisation]";"after ImperativeFilter: [personal data, processing, restriction, profiling, pseudonymisation, filing system, controller, processor, recipient, third party, ‘consent, personal data breach, genetic data, biometric data, data, main establishment, enterprise, group, supervisory authority, supervisory authority, ‘relevant and reasoned objection, information society service, international organisation]";"after DependentOfSameSentenceFilter: [personal data, processing, restriction, profiling, pseudonymisation, filing system, controller, processor, recipient, third party, ‘consent, personal data breach, genetic data, biometric data, data, main establishment, enterprise, group, supervisory authority, supervisory authority, ‘relevant and reasoned objection, information society service, international organisation]";"after PartOfSpeechFilter: [personal data, processing, restriction, profiling, pseudonymisation, filing system, controller, processor, recipient, third party, ‘consent, personal data breach, genetic data, biometric data, data, main establishment, enterprise, group, supervisory authority, supervisory authority, ‘relevant and reasoned objection, information society service, international organisation]";"after VerbLinkFilter: [processor]";"after SynsetFilter: [processor]";"after PerplexityFilter: [processor]"
"further processing for archiving purposes in the public interest, scientific or historical research purposes or statistical purposes shall, in accordance with Article 89(1), not be considered to be incompatible with the initial purposes (‘purpose limitation’).";"further processing";"after Initial: [personal data, processing, restriction, profiling, pseudonymisation, filing system, controller, processor, recipient, third party, ‘consent, personal data breach, genetic data, biometric data, data, main establishment, enterprise, group, supervisory authority, supervisory authority, ‘relevant and reasoned objection, information society service, international organisation]";"after ImperativeFilter: [personal data, processing, restriction, profiling, pseudonymisation, filing system, controller, processor, recipient, third party, ‘consent, personal data breach, genetic data, biometric data, data, main establishment, enterprise, group, supervisory authority, supervisory authority, ‘relevant and reasoned objection, information society service, international organisation]";"after DependentOfSameSentenceFilter: [personal data, processing, restriction, profiling, pseudonymisation, filing system, controller, processor, recipient, third party, ‘consent, personal data breach, genetic data, biometric data, data, main establishment, enterprise, group, supervisory authority, supervisory authority, ‘relevant and reasoned objection, information society service, international organisation]";"after PartOfSpeechFilter: [personal data, processing, restriction, profiling, pseudonymisation, filing system, controller, processor, recipient, third party, ‘consent, personal data breach, genetic data, biometric data, data, main establishment, enterprise, group, supervisory authority, supervisory authority, ‘relevant and reasoned objection, information society service, international organisation]";"after VerbLinkFilter: [processor]";"after SynsetFilter: [processor]";"after PerplexityFilter: [processor]";"considered";"after Initial: [personal data, processing, restriction, profiling, pseudonymisation, filing system, controller, processor, recipient, third party, ‘consent, personal data breach, genetic data, biometric data, data, main establishment, enterprise, group, supervisory authority, supervisory authority, ‘relevant and reasoned objection, information society service, international organisation]";"after ImperativeFilter: [personal data, processing, restriction, profiling, pseudonymisation, filing system, controller, processor, recipient, third party, ‘consent, personal data breach, genetic data, biometric data, data, main establishment, enterprise, group, supervisory authority, supervisory authority, ‘relevant and reasoned objection, information society service, international organisation]";"after DependentOfSameSentenceFilter: [personal data, restriction, profiling, pseudonymisation, filing system, controller, processor, recipient, third party, ‘consent, personal data breach, genetic data, biometric data, data, main establishment, enterprise, group, supervisory authority, supervisory authority, ‘relevant and reasoned objection, information society service, international organisation]";"after PartOfSpeechFilter: [personal data, restriction, profiling, pseudonymisation, filing system, controller, processor, recipient, third party, ‘consent, personal data breach, genetic data, biometric data, data, main establishment, enterprise, group, supervisory authority, supervisory authority, ‘relevant and reasoned objection, information society service, international organisation]";"after VerbLinkFilter: [personal data, restriction, profiling, pseudonymisation, filing system, controller, processor, recipient, third party, ‘consent, personal data breach, genetic data, biometric data, data, main establishment, enterprise, group, supervisory authority, supervisory authority, ‘relevant and reasoned objection, information society service, international organisation]";"after SynsetFilter: [filing system, controller, processor, recipient, third party, enterprise, supervisory authority, supervisory authority, information society service]";"after PerplexityFilter: [supervisory authority, supervisory authority, third party]"
"Personal data shall be adequate, relevant and limited to what is necessary in relation to the purposes for which they are processed (‘data minimisation’).";"processed";"after Initial: [personal data, processing, restriction, profiling, pseudonymisation, filing system, controller, processor, recipient, third party, ‘consent, personal data breach, genetic data, biometric data, data, main establishment, enterprise, group, supervisory authority, supervisory authority, ‘relevant and reasoned objection, information society service, international organisation]";"after ImperativeFilter: [personal data, processing, restriction, profiling, pseudonymisation, filing system, controller, processor, recipient, third party, ‘consent, personal data breach, genetic data, biometric data, data, main establishment, enterprise, group, supervisory authority, supervisory authority, ‘relevant and reasoned objection, information society service, international organisation]";"after DependentOfSameSentenceFilter: [personal data, processing, restriction, profiling, pseudonymisation, filing system, controller, processor, recipient, third party, ‘consent, personal data breach, genetic data, biometric data, data, main establishment, enterprise, group, supervisory authority, supervisory authority, ‘relevant and reasoned objection, information society service, international organisation]";"after PartOfSpeechFilter: [personal data, processing, restriction, profiling, pseudonymisation, filing system, controller, processor, recipient, third party, ‘consent, personal data breach, genetic data, biometric data, data, main establishment, enterprise, group, supervisory authority, supervisory authority, ‘relevant and reasoned objection, information society service, international organisation]";"after VerbLinkFilter: [processor]";"after SynsetFilter: [processor]";"after PerplexityFilter: [processor]"
"Personal data shall be accurate and, where necessary, kept up to date."
"every reasonable step must be taken to ensure that personal data that are inaccurate, having regard to the purposes for which they are processed, are erased or rectified without delay (‘accuracy’).";"having";"after Initial: [personal data, processing, restriction, profiling, pseudonymisation, filing system, controller, processor, recipient, third party, ‘consent, personal data breach, genetic data, biometric data, data, main establishment, enterprise, group, supervisory authority, supervisory authority, ‘relevant and reasoned objection, information society service, international organisation]";"after ImperativeFilter: [personal data, processing, restriction, profiling, pseudonymisation, filing system, controller, processor, recipient, third party, ‘consent, personal data breach, genetic data, biometric data, data, main establishment, enterprise, group, supervisory authority, supervisory authority, ‘relevant and reasoned objection, information society service, international organisation]";"after DependentOfSameSentenceFilter: [personal data, processing, restriction, profiling, pseudonymisation, filing system, controller, processor, recipient, third party, ‘consent, personal data breach, genetic data, biometric data, data, main establishment, enterprise, group, supervisory authority, supervisory authority, ‘relevant and reasoned objection, information society service, international organisation]";"after PartOfSpeechFilter: [personal data, processing, restriction, profiling, pseudonymisation, filing system, controller, processor, recipient, third party, ‘consent, personal data breach, genetic data, biometric data, data, main establishment, enterprise, group, supervisory authority, supervisory authority, ‘relevant and reasoned objection, information society service, international organisation]";"after VerbLinkFilter: [personal data, processing, restriction, profiling, pseudonymisation, filing system, controller, processor, recipient, third party, ‘consent, personal data breach, genetic data, biometric data, data, main establishment, enterprise, group, supervisory authority, supervisory authority, ‘relevant and reasoned objection, information society service, international organisation]";"after SynsetFilter: [filing system, controller, processor, recipient, third party, enterprise, supervisory authority, supervisory authority, information society service]";"after PerplexityFilter: [third party, supervisory authority, supervisory authority]";"taken";"after Initial: [personal data, processing, restriction, profiling, pseudonymisation, filing system, controller, processor, recipient, third party, ‘consent, personal data breach, genetic data, biometric data, data, main establishment, enterprise, group, supervisory authority, supervisory authority, ‘relevant and reasoned objection, information society service, international organisation]";"after ImperativeFilter: [personal data, processing, restriction, profiling, pseudonymisation, filing system, controller, processor, recipient, third party, ‘consent, personal data breach, genetic data, biometric data, data, main establishment, enterprise, group, supervisory authority, supervisory authority, ‘relevant and reasoned objection, information society service, international organisation]";"after DependentOfSameSentenceFilter: [personal data, processing, restriction, profiling, pseudonymisation, filing system, controller, processor, recipient, third party, ‘consent, personal data breach, genetic data, biometric data, data, main establishment, enterprise, group, supervisory authority, supervisory authority, ‘relevant and reasoned objection, information society service, international organisation]";"after PartOfSpeechFilter: [personal data, processing, restriction, profiling, pseudonymisation, filing system, controller, processor, recipient, third party, ‘consent, personal data breach, genetic data, biometric data, data, main establishment, enterprise, group, supervisory authority, supervisory authority, ‘relevant and reasoned objection, information society service, international organisation]";"after VerbLinkFilter: [personal data, processing, restriction, profiling, pseudonymisation, filing system, controller, processor, recipient, third party, ‘consent, personal data breach, genetic data, biometric data, data, main establishment, enterprise, group, supervisory authority, supervisory authority, ‘relevant and reasoned objection, information society service, international organisation]";"after SynsetFilter: [filing system, controller, processor, recipient, third party, enterprise, supervisory authority, supervisory authority, information society service]";"after PerplexityFilter: [supervisory authority, supervisory authority, third party]";"processed";"after Initial: [personal data, processing, restriction, profiling, pseudonymisation, filing system, controller, processor, recipient, third party, ‘consent, personal data breach, genetic data, biometric data, data, main establishment, enterprise, group, supervisory authority, supervisory authority, ‘relevant and reasoned objection, information society service, international organisation]";"after ImperativeFilter: [personal data, processing, restriction, profiling, pseudonymisation, filing system, controller, processor, recipient, third party, ‘consent, personal data breach, genetic data, biometric data, data, main establishment, enterprise, group, supervisory authority, supervisory authority, ‘relevant and reasoned objection, information society service, international organisation]";"after DependentOfSameSentenceFilter: [personal data, processing, restriction, profiling, pseudonymisation, filing system, controller, processor, recipient, third party, ‘consent, personal data breach, genetic data, biometric data, data, main establishment, enterprise, group, supervisory authority, supervisory authority, ‘relevant and reasoned objection, information society service, international organisation]";"after PartOfSpeechFilter: [personal data, processing, restriction, profiling, pseudonymisation, filing system, controller, processor, recipient, third party, ‘consent, personal data breach, genetic data, biometric data, data, main establishment, enterprise, group, supervisory authority, supervisory authority, ‘relevant and reasoned objection, information society service, international organisation]";"after VerbLinkFilter: [processor]";"after SynsetFilter: [processor]";"after PerplexityFilter: [processor]";"erased";"after Initial: [personal data, processing, restriction, profiling, pseudonymisation, filing system, controller, processor, recipient, third party, ‘consent, personal data breach, genetic data, biometric data, data, main establishment, enterprise, group, supervisory authority, supervisory authority, ‘relevant and reasoned objection, information society service, international organisation]";"after ImperativeFilter: [personal data, processing, restriction, profiling, pseudonymisation, filing system, controller, processor, recipient, third party, ‘consent, personal data breach, genetic data, biometric data, data, main establishment, enterprise, group, supervisory authority, supervisory authority, ‘relevant and reasoned objection, information society service, international organisation]";"after DependentOfSameSentenceFilter: [processing, restriction, profiling, pseudonymisation, filing system, controller, processor, recipient, third party, ‘consent, personal data breach, data, main establishment, enterprise, group, supervisory authority, supervisory authority, ‘relevant and reasoned objection, information society service, international organisation]";"after PartOfSpeechFilter: [processing, restriction, profiling, pseudonymisation, filing system, controller, processor, recipient, third party, ‘consent, personal data breach, data, main establishment, enterprise, group, supervisory authority, supervisory authority, ‘relevant and reasoned objection, information society service, international organisation]";"after VerbLinkFilter: [processing, restriction, profiling, pseudonymisation, filing system, controller, processor, recipient, third party, ‘consent, personal data breach, data, main establishment, enterprise, group, supervisory authority, supervisory authority, ‘relevant and reasoned objection, information society service, international organisation]";"after SynsetFilter: [filing system, controller, processor, recipient, third party, enterprise, supervisory authority, supervisory authority, information society service]";"after PerplexityFilter: [third party, supervisory authority, supervisory authority]";"rectified";"after Initial: [personal data, processing, restriction, profiling, pseudonymisation, filing system, controller, processor, recipient, third party, ‘consent, personal data breach, genetic data, biometric data, data, main establishment, enterprise, group, supervisory authority, supervisory authority, ‘relevant and reasoned objection, information society service, international organisation]";"after ImperativeFilter: [personal data, processing, restriction, profiling, pseudonymisation, filing system, controller, processor, recipient, third party, ‘consent, personal data breach, genetic data, biometric data, data, main establishment, enterprise, group, supervisory authority, supervisory authority, ‘relevant and reasoned objection, information society service, international organisation]";"after DependentOfSameSentenceFilter: [personal data, processing, restriction, profiling, pseudonymisation, filing system, controller, processor, recipient, third party, ‘consent, personal data breach, genetic data, biometric data, data, main establishment, enterprise, group, supervisory authority, supervisory authority, ‘relevant and reasoned objection, information society service, international organisation]";"after PartOfSpeechFilter: [personal data, processing, restriction, profiling, pseudonymisation, filing system, controller, processor, recipient, third party, ‘consent, personal data breach, genetic data, biometric data, data, main establishment, enterprise, group, supervisory authority, supervisory authority, ‘relevant and reasoned objection, information society service, international organisation]";"after VerbLinkFilter: [personal data, processing, restriction, profiling, pseudonymisation, filing system, controller, processor, recipient, third party, ‘consent, personal data breach, genetic data, biometric data, data, main establishment, enterprise, group, supervisory authority, supervisory authority, ‘relevant and reasoned objection, information society service, international organisation]";"after SynsetFilter: [filing system, controller, processor, recipient, third party, enterprise, supervisory authority, supervisory authority, information society service]";"after PerplexityFilter: [third party, supervisory authority, supervisory authority]"
